{
  "$schema": "https://json-schema.org/draft/2020-12/schema",
  "$id": "scenario-catalog.schema.json",
  "title": "Agent Golden Scenario Catalog v1",
  "type": "object",
  "additionalProperties": false,
  "required": ["schema_version", "fixture_roots", "fixture_path_template", "scenarios"],
  "properties": {
    "schema_version": {"const": "1.0"},
    "fixture_roots": {
      "type": "object",
      "additionalProperties": false,
      "required": ["legacy", "contract_v1"],
      "properties": {
        "legacy": {"type": "string", "minLength": 1},
        "contract_v1": {"type": "string", "minLength": 1}
      }
    },
    "fixture_path_template": {"const": "{fixture_root}/{scenario_id}/{fixture_key}/{plane}.json"},
    "scenarios": {
      "type": "array",
      "minItems": 17,
      "items": {"$ref": "#/$defs/scenario"}
    }
  },
  "$defs": {
    "scenario": {
      "type": "object",
      "additionalProperties": false,
      "required": ["id", "name", "variants"],
      "properties": {
        "id": {"type": "string", "pattern": "^GT[0-9]{2}$"},
        "name": {"type": "string", "pattern": "^[a-z0-9_]+$"},
        "variants": {
          "type": "array",
          "minItems": 1,
          "items": {"$ref": "#/$defs/variant"}
        }
      }
    },
    "variant": {
      "type": "object",
      "additionalProperties": false,
      "required": [
        "variant_id", "fixture_key", "entrypoint", "pre_state", "steps", "requirements",
        "refresh_action", "legacy_expectation", "contract_v1_expectation", "planes"
      ],
      "properties": {
        "variant_id": {"type": "string", "pattern": "^GT[0-9]{2}-[a-z0-9-]+$"},
        "fixture_key": {"type": "string", "pattern": "^GT[0-9]{2}-[a-z0-9-]+$"},
        "entrypoint": {"enum": ["chat_sync", "chat_sse", "scheduled", "handoff_resume", "channel", "message_feedback"]},
        "interaction_mode": {"enum": ["normal", "scheduled_task"]},
        "pre_state": {"type": "string", "pattern": "^[a-z0-9_]+$"},
        "steps": {
          "type": "array",
          "minItems": 1,
          "items": {"type": "string", "pattern": "^[a-z0-9_]+$"}
        },
        "legacy_steps": {
          "type": "array",
          "minItems": 1,
          "items": {"type": "string", "pattern": "^[a-z0-9_]+$"}
        },
        "contract_v1_steps": {
          "type": "array",
          "minItems": 1,
          "items": {"type": "string", "pattern": "^[a-z0-9_]+$"}
        },
        "requirements": {
          "type": "array",
          "minItems": 1,
          "uniqueItems": true,
          "items": {"type": "string", "pattern": "^AGENT-[A-Z0-9-]+$"}
        },
        "refresh_action": {"type": "string", "pattern": "^[a-z0-9_]+$"},
        "legacy_expectation": {
          "type": "object",
          "additionalProperties": false,
          "required": ["source"],
          "properties": {"source": {"const": "legacy_fixture"}}
        },
        "contract_v1_expectation": {
          "type": "object",
          "additionalProperties": false,
          "required": ["terminal"],
          "properties": {
            "terminal": {"enum": ["completed", "waiting", "failed", "cancelled", "handoff"]},
            "cancel_state": {"enum": ["none", "requested", "propagating", "settled"]},
            "duplicate_execution": {"type": "boolean"}
          }
        },
        "planes": {"$ref": "#/$defs/planes"}
      }
    },
    "planes": {
      "type": "object",
      "additionalProperties": false,
      "required": ["provider", "domain", "sse", "db_events", "conversation"],
      "properties": {
        "provider": {"$ref": "#/$defs/planeApplicability"},
        "domain": {"$ref": "#/$defs/planeApplicability"},
        "sse": {"$ref": "#/$defs/planeApplicability"},
        "db_events": {"$ref": "#/$defs/planeApplicability"},
        "conversation": {"$ref": "#/$defs/planeApplicability"}
      }
    },
    "planeApplicability": {
      "type": "object",
      "additionalProperties": false,
      "required": ["legacy", "contract_v1"],
      "properties": {
        "legacy": {"enum": ["required", "not_applicable", "deferred"]},
        "contract_v1": {"enum": ["required", "not_applicable", "deferred"]}
      }
    }
  }
}
