{
  "schema_version": "1.0",
  "fixture_roots": {
    "legacy": "fixtures/legacy_characterization",
    "contract_v1": "fixtures/contract_v1"
  },
  "fixture_path_template": "{fixture_root}/{scenario_id}/{fixture_key}/{plane}.json",
  "scenarios": [
    {
      "id": "GT01",
      "name": "plain_chat_sync_and_sse",
      "variants": [
        {"variant_id": "GT01-sync", "fixture_key": "GT01-sync", "entrypoint": "chat_sync", "pre_state": "new_session", "steps": ["send"], "requirements": ["AGENT-UX-REPLY-PARITY"], "refresh_action": "history_read", "legacy_expectation": {"source": "legacy_fixture"}, "contract_v1_expectation": {"terminal": "completed"}, "planes": {"provider": {"legacy": "not_applicable", "contract_v1": "not_applicable"}, "domain": {"legacy": "required", "contract_v1": "required"}, "sse": {"legacy": "not_applicable", "contract_v1": "not_applicable"}, "db_events": {"legacy": "required", "contract_v1": "required"}, "conversation": {"legacy": "required", "contract_v1": "required"}}},
        {"variant_id": "GT01-sse", "fixture_key": "GT01-sse", "entrypoint": "chat_sse", "pre_state": "new_session", "steps": ["send", "relay"], "requirements": ["AGENT-UX-REPLY-PARITY", "AGENT-UX-SSE-ORDER"], "refresh_action": "history_read", "legacy_expectation": {"source": "legacy_fixture"}, "contract_v1_expectation": {"terminal": "completed"}, "planes": {"provider": {"legacy": "not_applicable", "contract_v1": "not_applicable"}, "domain": {"legacy": "required", "contract_v1": "required"}, "sse": {"legacy": "required", "contract_v1": "required"}, "db_events": {"legacy": "required", "contract_v1": "required"}, "conversation": {"legacy": "required", "contract_v1": "required"}}},
        {"variant_id": "GT01-feedback-refresh-toggle", "fixture_key": "GT01-feedback-refresh-toggle", "entrypoint": "message_feedback", "pre_state": "persisted_assistant_message", "steps": ["history_read", "feedback_up_api", "feedback_clear_api", "feedback_failure_rollback"], "requirements": ["AGENT-FEEDBACK-REFRESH"], "refresh_action": "feedback_after_history", "legacy_expectation": {"source": "legacy_fixture"}, "contract_v1_expectation": {"terminal": "completed"}, "planes": {"provider": {"legacy": "not_applicable", "contract_v1": "not_applicable"}, "domain": {"legacy": "required", "contract_v1": "required"}, "sse": {"legacy": "not_applicable", "contract_v1": "not_applicable"}, "db_events": {"legacy": "required", "contract_v1": "required"}, "conversation": {"legacy": "required", "contract_v1": "required"}}}
      ]
    },
    {"id": "GT02", "name": "single_sop_ask_refresh_continue", "variants": [{"variant_id": "GT02-ask-refresh-continue", "fixture_key": "GT02-ask-refresh-continue", "entrypoint": "chat_sse", "pre_state": "new_sop_session", "steps": ["ask", "history_read", "continue"], "requirements": ["AGENT-UX-SOP-RESUME"], "refresh_action": "continue_after_history", "legacy_expectation": {"source": "legacy_fixture"}, "contract_v1_expectation": {"terminal": "completed"}, "planes": {"provider": {"legacy": "not_applicable", "contract_v1": "not_applicable"}, "domain": {"legacy": "required", "contract_v1": "required"}, "sse": {"legacy": "required", "contract_v1": "required"}, "db_events": {"legacy": "required", "contract_v1": "required"}, "conversation": {"legacy": "required", "contract_v1": "required"}}}]},
    {"id": "GT03", "name": "conditional_sop_both_branches", "variants": [
      {"variant_id": "GT03-true", "fixture_key": "GT03-true", "entrypoint": "chat_sync", "pre_state": "condition_step", "steps": ["select_true_branch"], "requirements": ["AGENT-GRAPH-BRANCH"], "refresh_action": "history_read", "legacy_expectation": {"source": "legacy_fixture"}, "contract_v1_expectation": {"terminal": "completed"}, "planes": {"provider": {"legacy": "not_applicable", "contract_v1": "not_applicable"}, "domain": {"legacy": "required", "contract_v1": "required"}, "sse": {"legacy": "not_applicable", "contract_v1": "not_applicable"}, "db_events": {"legacy": "required", "contract_v1": "required"}, "conversation": {"legacy": "required", "contract_v1": "required"}}},
      {"variant_id": "GT03-false", "fixture_key": "GT03-false", "entrypoint": "chat_sync", "pre_state": "condition_step", "steps": ["select_false_branch"], "requirements": ["AGENT-GRAPH-BRANCH"], "refresh_action": "history_read", "legacy_expectation": {"source": "legacy_fixture"}, "contract_v1_expectation": {"terminal": "completed"}, "planes": {"provider": {"legacy": "not_applicable", "contract_v1": "not_applicable"}, "domain": {"legacy": "required", "contract_v1": "required"}, "sse": {"legacy": "not_applicable", "contract_v1": "not_applicable"}, "db_events": {"legacy": "required", "contract_v1": "required"}, "conversation": {"legacy": "required", "contract_v1": "required"}}}
    ]},
    {"id": "GT04", "name": "parallel_sibling_merge", "variants": [{"variant_id": "GT04-merge", "fixture_key": "GT04-merge", "entrypoint": "chat_sync", "pre_state": "parallel_start", "steps": ["first_sibling", "second_sibling", "merge"], "requirements": ["AGENT-GRAPH-PENDING-SIBLING"], "refresh_action": "history_read", "legacy_expectation": {"source": "legacy_fixture"}, "contract_v1_expectation": {"terminal": "completed"}, "planes": {"provider": {"legacy": "not_applicable", "contract_v1": "not_applicable"}, "domain": {"legacy": "required", "contract_v1": "required"}, "sse": {"legacy": "not_applicable", "contract_v1": "not_applicable"}, "db_events": {"legacy": "required", "contract_v1": "required"}, "conversation": {"legacy": "required", "contract_v1": "required"}}}]},
    {"id": "GT05", "name": "pending_and_multi_frame", "variants": [
      {"variant_id": "GT05-pending", "fixture_key": "GT05-pending", "entrypoint": "chat_sync", "pre_state": "active_plus_pending", "steps": ["complete_active", "resume_pending"], "requirements": ["AGENT-SCENARIO-PENDING"], "refresh_action": "history_read", "legacy_expectation": {"source": "legacy_fixture"}, "contract_v1_expectation": {"terminal": "waiting"}, "planes": {"provider": {"legacy": "not_applicable", "contract_v1": "not_applicable"}, "domain": {"legacy": "required", "contract_v1": "required"}, "sse": {"legacy": "not_applicable", "contract_v1": "not_applicable"}, "db_events": {"legacy": "required", "contract_v1": "required"}, "conversation": {"legacy": "required", "contract_v1": "required"}}},
      {"variant_id": "GT05-multi-frame", "fixture_key": "GT05-multi-frame", "entrypoint": "chat_sse", "pre_state": "multiple_turn_frames", "steps": ["execute_frames_in_order"], "requirements": ["AGENT-SCENARIO-MULTI-FRAME"], "refresh_action": "history_read", "legacy_expectation": {"source": "legacy_fixture"}, "contract_v1_expectation": {"terminal": "completed"}, "planes": {"provider": {"legacy": "not_applicable", "contract_v1": "not_applicable"}, "domain": {"legacy": "required", "contract_v1": "required"}, "sse": {"legacy": "required", "contract_v1": "required"}, "db_events": {"legacy": "required", "contract_v1": "required"}, "conversation": {"legacy": "required", "contract_v1": "required"}}}
    ]},
    {"id": "GT06", "name": "reflection_retry", "variants": [
      {"variant_id": "GT06-retry-success", "fixture_key": "GT06-retry-success", "entrypoint": "chat_sync", "pre_state": "repairable_result", "steps": ["reflect", "retry", "complete"], "requirements": ["AGENT-REFLECTION-RETRY"], "refresh_action": "history_read", "legacy_expectation": {"source": "legacy_fixture"}, "contract_v1_expectation": {"terminal": "completed"}, "planes": {"provider": {"legacy": "not_applicable", "contract_v1": "not_applicable"}, "domain": {"legacy": "required", "contract_v1": "required"}, "sse": {"legacy": "not_applicable", "contract_v1": "not_applicable"}, "db_events": {"legacy": "required", "contract_v1": "required"}, "conversation": {"legacy": "required", "contract_v1": "required"}}},
      {"variant_id": "GT06-retry-limit", "fixture_key": "GT06-retry-limit", "entrypoint": "chat_sync", "pre_state": "unrepairable_result", "steps": ["reflect_until_limit"], "requirements": ["AGENT-REFLECTION-LIMIT"], "refresh_action": "history_read", "legacy_expectation": {"source": "legacy_fixture"}, "contract_v1_expectation": {"terminal": "failed"}, "planes": {"provider": {"legacy": "not_applicable", "contract_v1": "not_applicable"}, "domain": {"legacy": "required", "contract_v1": "required"}, "sse": {"legacy": "not_applicable", "contract_v1": "not_applicable"}, "db_events": {"legacy": "required", "contract_v1": "required"}, "conversation": {"legacy": "required", "contract_v1": "required"}}}
    ]},
    {"id": "GT07", "name": "knowledge_with_citation", "variants": [{"variant_id": "GT07-citation-refresh", "fixture_key": "GT07-citation-refresh", "entrypoint": "chat_sse", "pre_state": "knowledge_available", "steps": ["search", "stream_citation", "history_read"], "requirements": ["AGENT-KNOWLEDGE-CITATION"], "refresh_action": "open_citation_after_history", "legacy_expectation": {"source": "legacy_fixture"}, "contract_v1_expectation": {"terminal": "completed"}, "planes": {"provider": {"legacy": "required", "contract_v1": "deferred"}, "domain": {"legacy": "required", "contract_v1": "required"}, "sse": {"legacy": "required", "contract_v1": "required"}, "db_events": {"legacy": "required", "contract_v1": "required"}, "conversation": {"legacy": "required", "contract_v1": "required"}}}]},